{
  "schema_version": "1",
  "artifact_type": "plan-completion",
  "plan_id": "FS0-CORE-PLAN",
  "completion_conditions": [
    {
      "id": "COMP-001",
      "statement": "Selected Design, FS0-Core functional-set scope, and the complete modular Plan pass bootstrap Conformance and semantic review without candidate-runtime self-authorization.",
      "validation_ids": [
        "VAL-001",
        "VAL-002",
        "VAL-003",
        "VAL-007",
        "VAL-012"
      ]
    },
    {
      "id": "COMP-002",
      "statement": "All files listed by the Core Plan exist with the planned Core semantics and no implementation file outside accepted Plan scope is required for Core operation.",
      "validation_ids": [
        "VAL-006",
        "VAL-008"
      ]
    },
    {
      "id": "COMP-003",
      "statement": "Build mutation scope, declared predecessor use, Plan-prescribed validation, and repository validation all conform.",
      "validation_ids": [
        "VAL-008",
        "VAL-010"
      ]
    },
    {
      "id": "COMP-004",
      "statement": "Governance can record explicit non-circular Planning and Build acceptance with bounded authorization and resolvable Core lineage.",
      "validation_ids": [
        "VAL-005",
        "VAL-010"
      ]
    },
    {
      "id": "COMP-005",
      "statement": "Each retained Core normative requirement has valid identity plus governed Conformance and Assurance applicability and the selected minimal normative-statement grammar is enforced.",
      "validation_ids": [
        "VAL-006",
        "VAL-010"
      ]
    },
    {
      "id": "COMP-006",
      "statement": "Minimal durable Conformance, Assurance, and Build mutation evidence required by Core acceptance is schema-valid and resolvable from acceptance lineage.",
      "validation_ids": [
        "VAL-004",
        "VAL-005",
        "VAL-011",
        "VAL-010"
      ]
    },
    {
      "id": "COMP-007",
      "statement": "The built FS0-Core runtime can validate, semantically review, build, and govern acceptance of one subsequent extension functional set without out-of-band framework logic.",
      "validation_ids": [
        "VAL-009",
        "VAL-010"
      ]
    }
  ]
}
